Author,Text,Date,Score,Keyword
electronic_oldschool,It helps cows bodies.,1722989162,13,vegan
Mackfrenzy1895,"I think there's a lot more to both sides of this, that most people know. Both sides are massive industries that do not care about you or the environment. Most studies aren't very complete. Science is ever changing as we found out during covid. We also found out that it's very easy to be bought and paid for your expert opinions. The problem with the science behind diets is that human bodies are all so different. I know vegan athletes that do fine. I know ex vegans that ate very well and are active, but fixed health issues by adding eggs. I personally can't eat a lot of grains or legumes. So to say that a specific diet is best, doesn't really work. Also most studies about diets and health aren't taking in consideration of lifestyle difference. I'm not saying hotdogs are healthy, but some one that eats a hot dog is probably more likely to be less active, higher chance of eating chips and drinking sugar beverages. Compare to a vegetarian, who is more likely to be active and less likely to drink or smoke. So diets aren't the only thing that make people healthy. Its life style, stress levels, genetics... Another thing that a scientist at my old job told me, was that to truly see the differences between diets, you need to have genetically identical people to study. They have done a few twins studies that I've seen, and it seems that there's pros and cons for both sides. I've done many diets, and I've paid thousands of dollars to people to help with food issues. I've found what works for me.",1723041772,2,vegan
muscledeficientvegan,"Two big ones that are easier to quantify:

1) Your fiber intake will almost certainly increase and fiber intake has been strongly linked with direct reduction in chance of several diseases: https://www.health.harvard.edu/blog/should-i-be-eating-more-fiber-2019022115927

2) Your blood cholesterol levels will almost certainly be much lower. Saturated fat and dietary cholesterol aren’t as common on a vegan diet, so this will natural bring down your bad cholesterol levels. As a personal anecdote, my LDL has gone from right on the borderline of high on test result to now being officially flagging as “low” after the first year I was vegan, and it has stayed consistently in that low range. I’ve had a cardiologist and two primary doctors ask me what I’m doing to get those levels naturally after they get my blood tests back.",1722991492,6,vegan
Dr-Yoga,"Other books by Dr Greger, Dr Barnard, Esselstyn (Dr Caldwell & his firefighter triathlete son Rip) Dr Campbell & the book Forks Over Knives are useful references plus the videos on Netflix The Game Changers, What the Health",1722997632,3,vegan
999Bassman999,"Going vegan was the worst mistake I ever made. 
I felt completely terrible after 2 months. 
Constipation itchy skin brain fog and I couldn't put on any muscle. 
I went the other way after trying it.",1722991723,2,vegan
reebzRxS,Going vegan helps your soul. Going whole food plant based helps your body.,1723001380,3,vegan
Immediate_Outcome552,"Pros: you just eat more plants which can be good if your old diet lacked fruits and veggies, and especially good if you were overweight as fruits and veggies are more filling per unit calorie.

Cons: no single naturally produced vegan food is considered a ""high quality protein"". You will need to eat different kinds of vegan foods to get ""complete proteins"" in your diet (kinda like if you were in a video game and had to assemble a giant object that will save the world but the parts that make the object are scattered in different places).

Try it out if you're interested. I recommend supplementing with vegan protein powders to quickly counter the only con it has.",1722989129,4,vegan
AthleteLevel99,Watch the game changers documentary on YouTube. The answer is yea,1723018532,2,vegan
Bcrueltyfree,"Going vegan reduces cruelty and abuse to animals. 
It also reduces environmentally unfriendly emissions. 

It can be super healthy if you choose whole foods over processed foods. 
It can be super unhealthy too. 

But it's kinder to all.",1722999719,3,vegan
StrollMomLuxe,"I've noticed a big improvement in my digestive health since going vegan. More fiber in my diet has really helped with regularity and overall gut health. Plus, I feel less bloated and sluggish",1723004117,2,vegan
Acceptable-Net-154,"If you want to do this entirely for health reasons, would opt to go for a nutritional blood test first to check for any deficiencies that could be causing the issues you want to amend (fatigue, aches, poor immunity). Than with the results you can decide on what dietary choices is best for your health",1723009729,1,vegan
Easily_Marietta,"My periode got a day shorter. I can't say it's because l stopped eating meat and that stuff. But it was the only thing I changed and when l talked about it with other women did some of them mention there's periods had gotten shorter/easier to. So there may be something about it, even though it sounds strange",1723031893,1,vegan
astonfire,"Full disclosure I’ve been vegan for 17 years so I am biased. Pros, I get told I don’t look my age constantly, I have no issues maintaining a healthy weight, lab work at the doctor looks great. Cons, you have to think a bit more about your diet on a daily basis, protein is harder to get and you have to be intentional about protein intake, you should supplement b12 and vit d because they can only be found in animal foods or fortified foods. I went vegan in high school for the animals not my health and I ate like crap for a good 10 years. Oreos and potato chips are vegan too lol. Now I try to follow a whole food plant based diet and I feel a lot better",1723032581,1,vegan
pawnh4,Lol no,1723033872,1,vegan
-Xserco-,"Help it what?

Most of the alleged benefits come from just removing processed foods from your diet... same goes for the vast majority of proposed diets.

Otherwise, many of the claims are unfounded or easy to turn to healthy user bias.

Don't take your advice from YT or TikTok or even this sub. Just stick to the time tested stuff bud.",1723034636,1,vegan
rawnoms,"People experience a placebo effect of a diet being good no matter the diet. There's no magical diet and there's no benefit to cutting out essential nutrients like Vitamin D, B12, bioavailable Vitamin A, Calcium & heme iron that you only get from animals. Animal sources also have a more balanced amino acid profile for protein sources. Look up PDCAAS protein quality charts.",1723041114,1,vegan
jellybelly994,"I am vegan for ethical reasons and I don’t believe a vegan diet is inherently healthier. Vegans often pay more attention to what they are eating - so that may be a factor in some cases (avoiding ultra processed foods, etc). However I don’t think it’s right to say that factory farming is “natural.”  Animals are fed grains, corn, soy and pumped full of hormones. They are also literally tortured which can affect the quality of the meat as well. I think people should eat what they want and I don’t judge. But I don’t think it’s fair to say that eating meat is natural and therefore better than a vegan diet. There is nothing natural about the modern diet.",1723041180,1,vegan
shewwwn,"I was vegan for a few years but am not anymore. It really depends on what your overall diet is like. Not all vegans eat a healthy diet. There are some proven benefits of going vegan but it’s not for everyone. Our bodies are all different. That is something I did not want to accept as truth back when I was vegan lol. 

Not to be that person, but it is actually really important to be mindful of your protein if you go vegan. You CAN get your protein in, but it’s something you have to be much more conscious of. Ive experienced hormonal imbalances and nutrient deficiencies from not eating enough protein and now that I’m eating animal protein again, I actually feel much better and more energetic and have improved my hormones. I was eating pretty healthy as a vegan but was not getting the right balance of nutrients. Personally animal protein is better for my health and body. I also get sick less often than I did when I was vegan. 

If you go vegan and want to do it in a healthy way you really have to be willing to relearn how to cook with different ingredients and try new things. I had the time and resources to do that and really enjoyed it, but not everyone does.",1723041303,1,vegan
InterestingSpare1026,"Nutritionfacts.org
How not to die by Dr Gregor 
Forks Over Knives movie
I changed to a whole food plant based diet 3 1/2 years ago and it has improved every aspect of my health and life.
Amazing",1723045634,1,vegan
is_for_username,Yes. If you don’t like B12.,1723049349,1,vegan
starchildsdesigns777,"I would say generally yes. Im not vegan. I used to be for years but one day i ate some salmon and i felt like I had come alive again. I can't tell you why. I don't know the scienfic reasoning for it. I do have the mthfr gene mutation and Pyrolle disorder so maybe thats somehow related to how my body absorbs nutrients. Who knows. So now im a pescatarian. I have the beautiful choice to be able to choose what i eat. I eat only fish for meat and eggs sometimes. I dont eat dairy. It causes me to break out. Some day science will tell us which diet is best for us , but until then we can only guess through anectodotel evidence. I DO suggest eating WHOLE foods. cook nearly every meal you make from scratch. Eat a variety of foods. Eat organic. Grow your own food. The people who live above 100 are mainly vegans who eat small amounts of meat. We dont need alot of food. people over eat. Go on fasts. Go on cleanses. Clean your liver, clean your kidneys. The majority of your food should be plants i think.  thank me later.",1723066219,1,vegan
Yawarundi75,"Short term: if it means you’re abandoning a bad industrialized diet, yes. Long term: no.",1723067380,1,vegan
lucytiger,"I went vegan for environmental and ethical reasons but eating 100% plant-based I have seen significant improvement in my skin and digestion. If you're looking for a healthy approach, look into a whole foods plant-based diet.",1723068299,1,vegan
heavymetalbars,No. It does not.,1723071135,1,vegan
astrotekk,"Whole food vegan is an excellent diet to prevent heart disease, obesity, and diabetes. But you have to mostly eat unprocessed foods and try to avoid high fat and junk food",1723071956,1,vegan
Hex_For_Vex,Oh boy *sorts by controversial*,1723101398,1,vegan
DavidAg02,"I did plant based for a year... not true vegan, but 90% of what I ate was whole, unprocessed plants and the remaining 10% was processed vegan/vegetarian foods. 

For a very short time, I felt great. I think that is the result of eliminating a lot of the processed foods and drastically reducing the amount of sugar I was eating. 

That lasted for about 2 months. For the remainder of that year, I continued to feel worse and worse. It started with mild gas and bloating. I took some Tums and pushed through it, thinking it was just my body adjusting to the increased amount of fiber. It never went away and just got worse as the months went by. 

I was losing weight... except I didn't want to be losing weight, I wanted to be gaining weight. So what was happening? I was pretty darn sure I was eating enough calories. 

I had done a DEXA scan about a year or so before, and decided to go get another one. To my absolute shock, the weight I had lost had mostly come from muscle. I had lost a crazy amount of muscle mass in about 6 months of eating plant based, and my performance in the gym and how I looked absolutely confirmed that.

Ok, so how do I fix this? More protein, right? So I went hardcore on the plant based protein. Seitan/tofu/tvp/etc. However, as soon as I started doing this, the gas and bloating got worse AND I was finding it really difficult to eat enough of those very dense foods to get the amount of protein I was wanting to get. Impossible? No. Extremely difficult? Yes. 

So for the remaining 6 months, I basically force fed myself plant based protein and continued to feel gassy and bloated ALL OF THE TIME. I was miserable, and gave it up after a year. 

I now eat omnivore (50/50 plant and animal sources) but have continued to eat whole/unprocessed foods the vast majority of the time. I feel so much better. The gas and bloating are gone. My blood markers are ""extremely good"" according to my doctor, I'm killing it in the gym, very happy with how I look... basically all good things and this way of eating is very simple and sustainable to me. 

I miss French fries and Dr. Pepper, and will occasionally have those as a splurge... but that's really the hardest part of eating this way.",1723131084,1,vegan
ElPi56,"Zero benefits

I did this thing where i was eating a ton of vegetables and only about 160 grams of protein, some from meat and some from the trace amounts added up in vegetables.

Destroyed my gut, acne through the roof, low hemoglobin. Always felt cold asf

I cut out all vegetables and went purely animal based, I’m much better now.

Firsthand, I can tell you that the vegan diet is extremely unhealthy and destructive. You need animal food, you don’t need plant food",1723232367,1,vegan
Ill_Classroom_7052,"Look at all the vegans. They all look like holocaust survivors and are always pissy. 
I’d say no.",1723317499,1,vegan
HawkAsAWeapon,"This is purely anecdotal, but this has been my experience.

Before going vegan four years ago I ate a pretty decent diet. I went for leaner meats, had a fair amount of veggies etc. but probably a bit too much cheese.

I went vegan for environmental reasons and expected to feel a bit rubbish, as I have a very fast metabolism and need to eat a lot. A couple of weeks in to being vegan I felt amazing. My energy levels were constant and high (no more food comas even when completely full), and my nails were hard and shiny and my skin clearer. At this point I wasn't even particularly conscious of nutrition.

Since then I've become far more nutritionally-minded and feel even healthier, fitter, and stronger than ever before, despite being 4 years older and passing that 30 threshold.  I follow a predominantly whole-food plant-based diet. The thought of reintroducing any animal product into my diet (aside from ethical considerations) just seems like a massive step backwards. I'm seeing other people my age becoming overweight and looking significantly older, and whilst there may be other lifestyle factors at play I'm confident that my diet is something that is keeping me youthful and energetic whilst others are already experiencing decline.

As long as you are ticking all your nutritional boxes, a plant-based diet eliminates all those nasties. Saturated fat, cholesterol, inflammatory compounds etc., whilst more plants means more antioxidants and phytonutrients that reduce inflammation and prevent cancer, heart disease, diabetes, etc.

Aside from nutrition, a plant-based/vegan diet reduces your environmental impact on the world significantly (environmental health is just as important as individual health), and reduces as far as possible your contribution to animal suffering and killing. It's a win win all round.",1723327172,1,vegan
sebae91,"I followed a strict vegan diet for over a year to the point that I would ask a baker in a supermarket if the bread had butter (butter is not vegan).

At that point, I used to track around 10 vitamins and minerals.

Today, I track around 20, and the only supplement I take some days is vitamin D.

Based on my experience of having tried a vegan diet and tracking my nutrient intake this deeply, I will say this:

Meeting all vitamins and minerals is a lot more challenging. I won’t say it’s nearly impossible, but in my opinion, it’s unrealistic to sustain long-term unless you supplement and eat fortified foods.

When I followed a vegan diet, I had to eat nutrient-fortified foods to meet the vitamins and minerals I was tracking. However, I think these types of foods are more processed.

Today, I prefer to eat more minimally processed foods.",1722996982,1,vegan
Novafan789,"Theres no benefits compared to any other normal healthy diet. If anything it might be a con if you enjoy meat, eggs, or dairy and don’t enjoy many of the high protein vegan sources (some of them can be very acquired tastes). I know I’d prob be depressed if I had to limit my diet to only plants.",1723003983,0,vegan
Obvious-Role-775,No,1723011919,1,vegan
shiplesp,"I wouldn't do it, but there is no reason you can't try it and see whether it suits you.  As far as I know they don't make you sign a lifetime pledge.  If you don't like it or do well, you can stop it.",1722991402,1,vegan
sparkyparapluie,Lots of extra things to consider if you are a woman and looking to preserve your bone density.,1722996322,1,vegan
DrYarg,No.,1723028614,1,vegan
LBCosmopolitan,Health isn’t just about more fibers and low saturated fats. Health is about so much more. Even if you believe in these are the only 2 factors you can get a lot of fibers and a little saturated fats with a natural omnivore diet,1722995418,1,vegan
Psychological-East91,"Going plant-based can definitely help if you plan and are organized. Vegan is an ethical philosophy that accompanies more than just diet. But dietary-wise, it can be healthy if you eat more whole plant foods. You'll typically increase your fiber intake, cut out a lot of processed foods, and eat a diverse amount of vegetables, grains, legumes, and other plants. I've been vegan for about 7 months? And have lost 45 pounds (on a deliberate calorie deficit) and find it fairly easy to get my daily protein and micronutrients.",1722999379,1,vegan
tinkywinkles,No. Not unless you’re cutting out “unhealthy” foods as well. Or I guess if you can’t stomach animal products.,1723016063,1,vegan
LiamKelly1904,"Yes and no. If it’s an improvement on your old diet, you’ll feel better. Any fad diet is better than any bad diet. With that being said, the best diet by far is one that is balanced and whole-food focussed.",1723020983,1,vegan
CrotaLikesRomComs,Please do not go vegan. We have been eating an animal based diet for the last 2 million years. To remove something that we have evolved eating will have consequences. Please do not give into the propaganda.,1723033198,1,vegan
Ok_Geologist1376,It actually does quite the opposite of helping your body,1722993303,-2,vegan
LBCosmopolitan,"No. Vegan or 100% plant based diet doesn’t help your body. It’s not designed to do so either. 

An omnivore diet is usually the best diet for the general population. Vegetarian diet is healther than vegan diet too.",1722993707,-2,vegan
RotcodMD,"If we were a different species of animal, then yes it would.   
  
But as humans, no, eating vegan does not help your body.",1722999768,0,vegan
Marsrule,"NO. There is an argument for maybe vegetarian though. I had a vegan roommate and she had a ton of health issues from her diet. She had constant bloating, got anemia, constant headaches, indigestion, and actually LOW energy levels, amongst others. Shes still vegan but she also admitted that vegan food doesnt taste as good. Personally, when I starve myself from a lot of food I tend to binge eat a lot of sugary food which  isint healthy and very common to bidge eat sweets. The only people who are vegan are those who ONLY eat to live; never to enjoy. Ive gotten to eat a lot of vegan food since living with her because I was curious and it tastes disgusting. I tried to go vegan for lent and I couldnt do it; it was during school and I was so fatigued that I was like I cant do this and picked something else.",1722990031,-8,vegan
WhiteLightning416,"A whole food plant based diet, as long as you fulfill your nutritional requirements, is incredibly healthy and great for longevity. You could mix in the odd egg or piece of fish as well to make sure you’re getting everything you need. That’s basically the Dean Ornish diet which is recognized as the healthiest diet and it’s the diet that saved Bill Clinton’s life and basically the diet all the old rich elites eat to stay alive and healthy longer lol",1723001715,0,vegan
EverybodyPanic81,Absolutely not.,1722989689,-6,vegan
SmallTitBigClit,"I’ve tried being vegan for an extended period of time. No major difference in energy levels. I never eat / ate processed vegan meats or tofu stuff either just because I never liked that stuff.
I feel like vegan food is harder to digest hence keeps me full longer. Also, lot of the calories consumed end up going towards digesting the food, so I tend to eat more and don’t see a difference in body weight with the added calories. 
The big difference I did notice is in my skin. Never had issues with my skin to begin with, but when I’m vegan for a few weeks, there’s a marked difference in skin glow and smoothness.
I end up going vegan now from time to time just for this purpose. Other than the skin health, I don’t think veganism is for me since the stuff I find palatable leaves me with very very limited options and there’s only that much salads and soups I can have on the regular.",1723003217,-1,vegan
ZenMechanist,"Short answer: no. 

Long answer: not unless what you were eating before was worse for you than whatever “vegan” diet you end up eating. If you subsist on cured meats, trans fats and spoonfuls of sugar then yes going vegan will almost certainly help even if it just introduces highly processed vegetables & fibre into your diet. 

But if you ate healthily, with lean meats & fatty fish, then decided to cut them out for whatever reason, you certainly won’t be healthier.",1723024359,-1,vegan
unusualname3,"Reduced my intake of meat, lost a lot of hair, try it yourself if you want to end up bald.",1722993749,-3,vegan
General_Step_7355,Go vegan but with your own chickens for eggs and goats for milk products to get b12. Then eat meat when they need processed for the many farm reasons. If you don't have the land then you are doing great. Eating eggs from properly raised chickens is a win win for any health or ethical reason.,1722994544,-3,vegan
Worldly_Radish2969,NO,1723002088,-1,vegan
Anfie22,No way. I tried it for a while and it was the sickest I've ever been in my life. I became bedbound.,1722995423,-4,vegan
SurlierCoyote,Have you ever seen what a vegan looks like after a free year's in that diet? They look malnourished. Beef should be the cornerstone of your diet.,1722994117,-7,vegan
Mixedmarilyn,Don’t eat that fake meat bs but yes there are benefits to temporarily eating plants and grains only. Like detox benefits and clearing out your digestive system. When I go plant based I take 3 dumps a day. You don’t realize how much is stocked up in your gut,1723005295,-1,vegan
kobegoat222444,"Short term yes like a seven day fruit and vegetable fast but I get constipated if I don’t eat meat and eggs

And eggs are full of nutrition",1722990704,-5,vegan
_extramedium,really depends on what you eat now and what your vegan diet consists of. But its not likely to be healthier than a good omnivore or vegetarian diet,1722994477,0,vegan
luvlyapp,"I'm not there yet, but I’d love to try going vegan someday. My friend has been vegan for about 4 years now and has had some really positive results. They’ve noticed a big boost in their energy levels and their digestion has definitely improved. Plus, they feel great about their ethical choice and how it aligns with their values.

Of course, it hasn’t been without its challenges. They’ve had to be careful about getting enough nutrients like B12 and iron, and sometimes social situations can be a bit tricky. But overall, they’ve found the transition to be really rewarding.",1723034184,0,vegan
major_tom_56,"I went down thorugh this 'what to eat' rabbithole couple of months ago only to find myself confused af at the end. Having load of information but still not sure what judgment to make of... Then I just did one thing, look at my surroundings, see what other healthy people are eating, see which diet favoured my family since my ancestors.. and just incorporated a balanced diet. I now eat carbs, protien, fats, veggies & fruits, everything that doesn't cause an allergy or disturb my digestion",1706166695,599,keto
pot8tow,"I think it's worth noting that Eric Berg is a chiropractor while Michael Gregor is a medical Doctor. In terms of academic rigor / credibility, Dr Gregor is miles ahead. They're honestly not in the same ballpark.",1706172161,430,keto
