Author,Text,Date,Score,Keyword
Prestigious_Spell309,"A small part of me is convinced the “everything is fine in  moderation” people want everyone to get sick, fat and or die.  Even in the hospital  with blood sugars of 330 to 197 (01/05/2024 ) I was given juice, brownies, brown rice, toast, penne pasta, etc as part of my nutrition plan. When I was discharged I was told to eat every 3-4 hours and carbs at each meal so my blood sugar “didn’t get too low” just stopped eating anything but meat / veggies / dairy really my blood sugar plummeted. I had to stop injectable insulin in a month. Now even when i have the occasional ice cream im not getting to 180-220 blood glucose I may hover around 120 for an hour. My insulin sensitivity is just that much better.   A1C down from 6.4 to 5.1 in less than a year.    My doctor asks like I’m an incredible modern miracle. No miracle just not listening to your insane advice to eat 30-50g of carbohydrates 4 times a day 😩   I’d be fatter, sicker and taking more and more insulin every month like every newly diagnosed diabetic if I’d followed any of their advice. The support group I was in for the newly diagnosed I’m the only person that lost a bunch of weight and now has normal blood glucose numbers thad  isn’t on insulin / mounjaro / metformin etc it’s really quite sad  I was 9 weeks pregnant I was diagnosed and the drs all told me repeatedly I was too early for it to be gestational diabetes  that I was a type II diabetic and just didn’t know it until then. As my numbers got better and I got off all medication they’ve gone back and forth over whether i’m actually diabetic at all 😅",1722440605,2,keto
FooFatFighters,Because people have been brainwashed. The first rule of Keto Club is to not talk about Keto...unless asked....nicely.,1722476036,2,keto
Longjumping_Bed3612,Keto gets shit because people are stupid & ignorant. It’s on the proper human diet spectrum. Folks claim it’s a fad. Funny how a diet that humans have eaten throughout history could be a fad.,1722520035,2,keto
iamintheforest,"There is a large body of research that shows that saturated fat is bad.  Further, there is some research that shows increase in LDL (bad cholesterol) on keto.  I have developed a few opinions here:

1. the keto and LDL connection is real, but often confounded by the impact of weight loss on LDL.  Also worth noting that the data on LDL and it's status as an indicator of future health disease in isolation of other factors is getting weaker by the day.  But...If you lose a lot of weight quickly your LDL is likely to rise regardless of what you're eating.  Since much of the impulse for ketogenic diets is wrapped in weight loss ambitions this seems like a rough connection and needs more research.  Speaking anecdotally I went keto for blood glucose regulation (wanted to be steady, not heavily fluctuating) and not for weight loss (former pro athlete, have struggled to gain weight not lose it, etc.) and while I never had cholesterol problems on Keto they got better, not worse.

2. doing keto half-assed is - I believe - an increase in risk relative to a classic ""moderately low carb Mediterranean diet"".  Why?  Because saturated fat in the presence of high glucose is definitely, non-controversially awful for you.  I think we can attribute the health disaster of the american diet on carbs + fat at the same time.  So...if you fail to reduce carbs sufficiently AND increase saturated fats that's probably pretty bad over a long run.  That's what ""Half ass keto"" can do.

3.  Insulin and blood glucose are pretty harmful to your body.  Keto lowers both of these (insulin being THE control mechanism for ketone production/cessation and glucose being the thing that triggers insulin creation).  If you have to choose between LDL and high insulin and glucose I think LDL is a great choice to have more elevated than glucose/insulin.  For about half the american population this choice is very very real given the prevalence of insulin resistance (which causes higher glucose levels and gets your pancreas to pump out even more insulin to compensate, eventually failing to do so - aka diabetes or pre-diabetes).

4. For me being in ""ketosis"" isn't actually important to me from my understanding of my health.  However, it's _easier_ to be in ketosis than to try to sustain a regulated glucose/insulin level at ""low carb"" levels - the roller coaster of glucose makes it harder to get the glucose/insulin outcome I want (this is doubly true for severe diabetics).  So...keto is _practical_ in this regard since I've dismissed the idea that i need to being fighting biology with some force of will as if my mind and my body aren't the same system!  

5. Similar to 4, but another practical angle. The popularity of keto means that there is lots and lots of cooking/recipe advice and I LOVE cooking and love food.  So...it's just practical to be attached to a diet that is popular and has things like this sub.  I find the commercialization of ""net carbs"" extraordinarily problematic (you only need a little time on a CGM and a little understanding of the FDA testing methods allowed for carbs to learn that it's a landmine of false information (see the sugar alcohols portion of the FAQ here, but a similar problem exists for fiber leading to the business side of food trying to capitalize on ""keto"" and just not doing a great job!).  So...if you look around you'll see an increasing prevalence of highly processed foods in the keto landscape.  I think this poses a risk of other health issues and also serves to keep people attached to food habits from their high carb days.  I find whole, health, fatty stuff from nature to be the best way and am wary of the current commercial trends (to say the least).  I question whether I could eat keto the way _I think_ is healthy and works for me if I were not doing well financially.  Cost per calorie on Keto is high if you're following the principles I try to. My beef budget could by a Lamborghini.",1722362660,3,keto
fuggystar,"Indoctrination. Dietitians chirping that you need to eat alllll food groups when clearly people run fine without carbs…I love when people are shocked when they find out I don’t eat carbs and still have energy. 

Many RD programs are bought out by big food companies who fund the garbage studies which they base their curriculum/propaganda on.

I mean I’m just really disenchanted with all medicine rn to begin with in general. 

Oh and the “diet culture” garbage. When someone refers to “diet culture” it’s a big red flag that they’re about to condescend you.

I just don’t tell people but I still get it indirectly from other places.",1722390644,2,keto
ban-v,"There are two great books that go into this. Good Calories, Bad Calories and The Big Fat Surprise.",1722362882,1,keto
iplayblaz,Because carbs are delicious.,1722366480,1,keto
Alexandronaut,"From people doing dirty keto and all these new trends like carnivore and eating straight butter lol. If you’re drinking heavy cream, eating fried cheese with butter and mayo, that’s where the issue is. If you actually do it properly it’s the best IMO",1722367556,1,keto
aztonyusa,"Go to YouTube and search for Dr Ovadia and Dr Nadir Ali, both are cardiologists. You have to understand doctors have very little training in nutrition. They also have to follow the rules from the AMA about following the SAD diet or lose their license.",1722371200,1,keto
The_Uncomfortables,Agreed. It's very easy unless you're asked out to dinner or invited to a meal at someone's house.,1688167117,368,vegan
Vegoonmoon,"Welcome to your paradigm shift!  Embrace it because there is a LOT of information out there that is counter to what you were taught. It sounds like you’ll find it as intensely interesting as I do.

When I went through my shift, I binge-watched documentaries. If you’re into them, I’d suggest Forks Over Knives for health, The Game Changers for fitness, Cowspiracy for the environment, and Dominion for animal welfare.",1688167175,84,vegan
Particular-Formal437,Going vegan for me was so easy.  I cook the same exact meals just substitute a few ingredients.  I live near a big city so even eating out simple.  Only thing that was an annoyance (and still is) is during family gatherings which I have to make my own meals.,1688169690,36,vegan
Theid411,"If you care enough - it's easy. It took me a bit longer to go from thinking about going to vegan to actually doing it. Almost 10 years, I'd say. For me - I had to reprogram my brain. The first few  times I tried going vegan - I failed - simply because I didn't care enough. Over the years - that changed - and one day, I did care enough.",1688167623,72,vegan
Ness303,"Being vegan is easy. It's only viewed as hard for most people because they would have to be conscious of the food they're consuming, and they don't want to do that. They want to stuff their faces with impunity.",1688174850,18,vegan
tiredashellalready,"I'm actually noticing that a LOT of animal products are slowly but surely growing in price while the vegan products prices tend to stagnate. I made excuses about prices when it came to going full vegan but I realize now that prices are now no longer able to be blamed. Hell there is a vegan food truck next door to me now (which gives me the excuse to make my days off my ""Vegan days"" since my family is.... Animal product heavy and I don't have the cash to move out and hated it when I made vegan food or veggie heavy food (my step dad doesn't like veggies at all) thankfully they are completely on almond milk thanks to my stepdad being lactose intolerant but his weakness is cheese and ice cream and can't move over to Vegan cheez or oatly ice cream (which is better than cows milk based ice cream and I'll fight people on that).

I'm still trying to rack my brain on getting them to do a Veganuary. I've been trying to figure out how to pitch the idea to do so. I mean I still have yet to find a good meat replacement for burgers (which is my weakness). And I realize I have something else to ask the Vegans here so I shall make my own post. Keep going you bad ass!",1688170744,17,vegan
furryhippie,"I think most people feel like ""being vegan"" comes with a lot of pressure to have this perfect lifestyle, so if they can't do it all, they don't do any of it.  Fair or not, veganism has a militant stigma for most of society, so for someone to break through that and make the effort, day by day, to make little changes and learn the process of figuring out life without animal products...it really takes someone who cares a lot and doesn't worry about perceptions or labels.

This thread is refreshing, a lot of people encouraging change without being forceful.  People who say they are ""90% Vegan"" tend to get ripped apart in lots of these talks, as the V-word can be very much gate-kept online.",1688173613,26,vegan
xxsilentsnapxx,Yeah i went through the same thing lol. My boyfriend and I have veganized literally everything and it usually tastes phenomenal. I can’t ever go back.,1688179398,10,vegan
YoungWallace23,"I’m gonna be the unpopular one in the thread and say that the “1%” stuff is not worth feeling stressed about. You learn more over time. When you shop, glance at the ingredients list and do your best. If you see “milk powder”, skip that one and buy something else. It’s ok if you don’t cut out those final 1% items overnight. Challenge yourself to Google at least 1 ingredient each time you’re at the grocery store until you eventually get them all down. There’s random animal products everywhere. It took me a year of being vegan before I heard about white sugar and bone char (but since I learned about it, I immediately cut it out). You pick these things up over time. Do what you can, and you’ll get there. It’s a lifestyle change, it takes time.",1688168430,60,vegan
reyntime,"Yeah it's easy as these days. I used to think I couldn't give up cheese. Then I found out what happens in the dairy industry, and gave it up. Easy.",1688181803,9,vegan
_tomato_paste_,"I live in the middle of nowhere practically and it’s still so easy to be about 90% vegan, which I’ve been doing for the past month or so. I’ve figured out my weaknesses are coffee drinks with cold foam (I’ve asked them to make the foam with oat milk but they said no) and this one particularly tasty local restaurant. I think I’m going to finally commit 100% starting next month/tomorrow.",1688179908,7,vegan
Intelligent-Dish3100,You could donate your meat in your freezer to a food bank. The reason why milk powder is in everything is because it’s subsidized by the government. If they took away those subsidies the dairy and meat industry would be fcked as we know it.,1688185954,7,vegan
moonmusicals,It's so easy being vegan 🤣 😭 it shocks me and I love being fully energized and living just off of plants,1688179524,6,vegan
bobbaphet,"Being like 100% Vegan is embarassingly easy, what gives?",1688209415,6,vegan
freezingkiss,"This is why I always advise people to reduce and not eliminate if they're rusted on. Early on, I took steps such as: being vegetarian at home and only eating meat when I went out, having ""vegan weeks"" where I would challenge myself to be fully vegan for a week, cutting out what I deemed to be more ""problematic"" foods such as foie gras, lamb, veal, duck etc and other baby animals, and more.

People in these stages probably will find themselves being vegan eventually. I got so much positive feedback during that time, it was a good motivator. I think demonising people who are say, vegan except one thing, is not the right way to go about it. Most of the time they'll get there on their own, and even if they don't, their diet isn't the one we need to be criticising, as it's still FAR from the SWD (standard western diet).",1688194035,5,vegan
TheAntiDairyQueen,Watch DOMINION yesterday,1688180585,9,vegan
xboxhaxorz,"Attitude is the main thing in determining how difficult life can be and veganism is no different  
  
People say veganism is hard, others say its easy  
  
For me veganism isnt a choice, i have to be vegan because the alternative is being an evil person and thats simply not who i am, when you feel its a choice to be vegan you might consider some aspects of it to be difficult  
  
I have traveled and met people from all over the world and veganism was never an issue, sure it took more effort to find plant based meals but it wasnt difficult  
  
Some families and friends are toxic and mean and that could make it difficult if you allow it, i remove toxic people from my life, i dont forgive or forget and im much happier for it, i take bad behavoir seriously and i respect myself enough to avoid situations that would make me feel bad",1688168807,8,vegan
MountainSnowClouds,"Why not just donate the meat to a food bank or a neighbor, especially if it's already starting to gross you out? That way at least someone who is already going to want to eat meat buys a little less because they already have some that they received for free.",1688176312,9,vegan
ryvi2a1,100% agree with this! Its because you have unlocked a dark secret of the world. Tbh most vegans will agree that the hardest thing about being vegan is dealing with peoples bs,1688193654,3,vegan
Webgiant,"I'm just surprised that the cheapest Ramen packs, such as Maruchan, have meat products in them, while twice as expensive Top Ramen Soy Sauce flavor is meat free.

Twenty years ago Veganism was harder to transition into. Now with a dozen meatless meat shaped product lines and lots of dairyless cheeses, going vegan is embarrassingly easy.",1688194051,4,vegan
perigou,"Giving up meat is very easy. Giving up the rest can be more difficult when your country isn't very ""vegan-friendly"" (if I want a vegan pizza, I have to go to the one vegan store in my city, there isn't vegan pizza anywhere else. When I go out to eat with my friends I have to check the place bc the restaurants that have vegan options are rare. etc). It's easier when you don't use industrialized products, but getting there was way more difficult than just cutting out meat.",1688200917,4,vegan
Fenpunx,"If it's that easy, go 100%.",1688205691,4,vegan
WhiteLightning416,"Agree, 90% is easy because it’s basically just replacing animal based stuff with the vegan version. The last 10% is basically when it gets a bit socially awkward, and while most here will disagree, it doesn’t bother me if people wish to avoid that awkwardness. We’d be a more vegan world if 90% of the population was 90% vegan and to me it’s the socially awkward aspect that holds most people from going all the way with it. And besides there is not such thing as 100% vegan, everyone draws the line somewhere for some it’s oysters/mussels for others it’s 2nd hand leather, for others it’s smart phones/computers lol",1688177453,8,vegan
gustmes,"To answer your last question: because the ones behind meat dairy, and cheese are VERY powerful farmers and businesspeople that they exert a lot of control over politics, economy, and society. Just look at the absurd subsidies that governments in the West give to these big companies. Look at how you will rarely see advertisement for vegetables, but always ad for cheese, yogurt, milk, etc.

I can talk more deeply about the case of Brazil, in which the AgriBusiness eve has ties with the military dictatorship that happened in the past, with the genocide of native populations, etc. etc.

PS: politics aside, it's WAY easier being vegan than most people think. You are absolutely correct IMO",1688183853,3,vegan
NectarineThat90,"I actually disagree, at least for myself. The eating part is one thing, but everyday I learn more ways that Animals are consumed in almost all of our products. Also, the mental aspect of feeling helpless/constant anguish knowing how many animals currently are, have been, and will be subject to a life of pain is very overwhelming and is something that weighs on me every moment. 

But any minor or major difficulty I have in no way makes me even fathom ever going back and in NO WAY even compares to the plight of animals",1688193060,3,vegan
paperpigeons,Being 100% vegan is also piss easy I’d recommend just going for it. I have a few health issues in relation to diet but even then I did it overnight and it was easy :’],1688199340,3,vegan
JKMcA99,Being 100% vegan is embarrassingly easy.,1688218498,3,vegan
LukesRebuke,"Being 100% vegan is incredibly easy, too. Non-vegans just don't like change",1688225868,3,vegan
VeggieWokker,That would be 90% plant based. Veganism is not fractional.,1688208307,5,vegan
vvneagleone,The technical aspect of it -- drawing a line and not eating animals -- turned out to be incredibly easy. The mental task of thinking about making what looks like maybe a huge life change and dealing with the social (etc) consequences seems to be daunting for some people before they try it. It wasn't for me thankfully.,1688200937,2,vegan
CuTup4040,"Going out for dinner in a vegan friendly town and ""having to"" limit yourself to the vegan option which, for the average taste bud, tastes okay instead of good: oh no the humanity",1688209212,2,vegan
Non_Dairy_Screamer,"It was also easy for me, but I will partially answer your question by saying that most people don't agree with you about cheese and butter, and you're lucky that a vegan pizza is $5 wherever you live. They are like $13 here while the non vegan ones are $5.",1688209722,2,vegan
Frubanoid,"If we end meat subsidies, that will make the true cost of meat apparent to a lot more people.",1688211523,2,vegan
StefanMerquelle,"I def agree. 

Social situations are still tough when you’re the minority so even they are <1% of the journey they carry a lot of importance.",1688220745,2,vegan
AnarVeg,Good on ya bud! But to answer your question of how meat is even profitable the answer is the (50 billion in the US) government subsidies as well as the culture of meat necessity pushed constantly. I'd say it's a conspiracy but it's not that well hidden.,1688222823,2,vegan
CanadaGuy32,“Meat is starting to taste gross to me” - I agree with this.  If there is a plant option chances are I’ll take that. I’m the 85% because paneer is great and I’ll substitute a meat thing if I’m desperate.  I’ll get there eventually.,1688224142,2,vegan
ontether,Funny you should mention cheese bc cheese is often the reason cited for not going vegan… and my pretty much anti-vegan dad has made the switch to almond milk and non dairy cheese after I bought it for a visit. He said he realized that dairy was making him “snotty.” 😂,1688226059,2,vegan
Great_Cucumber2924,"Yep. You just have to remember what you were like before the switch flipped, it just doesn’t occur to people to go vegan. I don’t think most people understand the harm we do to animals until that something happens. 

Also, do look into a supplement routine if you haven’t already. It’s important for making sure you can make this sustainable.",1688230177,2,vegan
Independent_Error404,"Why do you put milk powder in you broccoli? Use some garlic if the taste of pure broccoli isn't enough for you. But that's unnecessary, broccoli is the best vegetable. I could eat it all day.",1688236379,2,vegan
ConvenienceStoreDiet,"Remember that you just started looking into it and appreciating it recently and others still have yet to discover it. Most people are fine in their routines that they don't seek change or are preoccupied with their stuff, so they won't see it the same way you do. But yeah, eating vegan is easy. At first it's tough to figure out some of the nuances and having to read labels. But if you cook vegan, it can be insanely cheap. If you eat out vegan, the vegan places can be a little pricier. There's no reason milk powder and gelatin need to be in everything. But they are in a lot of stuff. But it's easy to stick to produce and the vegan section of the freezer.

Also, to aid you on your journey, if you want a good list of vegan foods and snacks and stuff so you don't have to guess, check out [Besties Vegan Paradise's](https://bestiesveganparadise.com/collections/all-products) list of vendors. Great way to find new foods and brands. No Whey ""No Tricks"" vegan twix have been my jam. Otherly chocolate is great, too.",1688236695,2,vegan
xieghekal,"I'm so happy to hear this! If you live in the West, it's incredibly easy and can work out a lot cheaper as well. One suggestion - if you feel ready to ditch the animal products, could you maybe donate them to a food bank or animal shelter if it's raw meat/fish?",1688246321,2,vegan
mackattacknj83,There's never been an easier time to be vegan I suspect. The regular ass grocery store sells tofu.,1688309257,2,vegan
Coffee_Cupcake,"First of all: congrats on the lifestyle choices and changes!! 90% vegan is amazing and its impact on the environment and your health is already commendable. 

Next, I agree that making vegan choices seems almost too easy in 2023 and it feels odd. After all, we’re told by non-vegans that it’s just too hard/ too much of a shock to the system/ there are no good options/ it’s inconvenient/ etc. After a bit of time though, we discover all the choices that we have in food, fashion, cosmetics, even luxury items like going to a spa or getting a manicure. The fact that it’s NOT hard does feel suspicious, like ‘am I doing this wrong?’

Finally, enjoy the process! Not everyone is the perfect vegan from the word go. Most of us got there gradually, often by using up non-vegan items that we’d already purchased, then choosing the vegan and cruelty free option when replenishing whatever it was.

I think many people are unnecessarily harsh towards newbies who are most of the way there, and not totally there just yet. I feel their judgment is discouraging and demotivating, so I hope you can overlook some of the comments that are impatient and unsupportive.

Progress, not perfection! You’ll kick that last 10% to the curb soon enough.",1688331921,2,vegan
Excellent-Injury8298,in the USA the animal industry is heavily subsidized by our government. The industry employs a ton of people and is therefore important to the government as a way to create and maintain jobs. They subsidize these businesses to help them keep employees and pay them. the businesses then can afford to sell the product for super cheap. This is a huge reason why heavily impoverished areas often have higher rates of obesity and diabetes. It is actually more expensive to buy healthy options like raw produce in many areas. Super sad stuff,1688183598,2,vegan
NASAfan89,"Yes, there is a conspiracy.  You can learn about it in the film Cowspiracy.",1688185852,2,vegan
HuntTheWiIds,"What were your steps to being 90% Vegan? As a 1-2% Vegan, I'm trying but don't know where to start or how...",1688196861,2,vegan
ErrantQuill,"Non-ED baby steppers are cringe. Donate the animal flesh to those in need and stop making excuses. Maybe feed a predator and spare some prey animals yeah? So many options other than savouring the last dregs of your carnism.

Also, reading labels is not that hard.

>Anyone else slow-walking into veganism plagued by that weirdly uneasy feeling like you suddenly learned some forbidden secret or there's some kinda funny business going on in the world?

Can't relate, not a cringelord baby-stepper.",1688177378,3,vegan
