Author,Text,Date,Score,Keyword
Sallysinger2003,"I decreased my carbs but I’m no where near keto and I feel the best I have been. Essentially cured my gut issues. Maybe try a more balanced and less extreme version first :)

Not saying keto is bad FYI, I follow this subreddit for a reason!",1723322910,133,keto
thatsusangirl,"Yeah, I do enjoy it. I feel like I’m no longer a slave to my own impulses to constantly eat rice potatoes and oatmeal. When I eat carbs, I am never not thinking about food. If there are carbs in the fridge, it was like I had a little voice whispering in my ear telling me to go back and eat more of all of it. My body is just like that. Keto feels so peaceful in comparison.",1723323161,315,keto
Ok_Owl3571,"It's wonderful and comforting knowing that whatever I eat while on Keto, it won't make me fat.  Prediabetes is becoming a distant memory now. 115lbs down and I’m never going back",1723324561,33,keto
BeeDefiant8671,"Yes.  Once I got over my addiction to food.  And reset pleasure baseline around eating.

What helped me understand was-
A 72h sardines in oil fast.  

There are a lot of layers to our relrionship with food and sustainance.  The compulsions, deprivation and satisfaction are so layered.  

I also listens to a weight loss podcast, learned skills and let go of beliefs that were not serving me.  It was a lot of mental work…

Today, one day at a time,
I’m at peace with food.  It’s simply fuel.

Healthy-
Feels so good in body and mind.
I tried to get addicted and really FEEL healthy.",1723323852,26,keto
anselgrey,"Carbs (potatoes, rice, bread were definitely my favorites and grew up on them as they were cheap compared to veggies and protein). However, carbs cause more cravings for carbs and got tired of being unhappy with my body and my mind a slave to food noise and the dopamine hits. I guess you can say I love keto because it gives me back control and the body that I like how it looks in clothing (and without).",1723325355,26,keto
Estilady,I truly enjoy living this lifestyle.  I feel a lot better.  It works well for me.  I don’t eat beef/pork/chicken but I do eat fish/scallops/shrimp.  I’m very limited on a lot of foods because I’m a 25 year colon cancer survivor.  I don’t have a colon and I have a lot of GI issues.  But keto helps a lot.  Also I gave up coffee which is a trigger for unpleasantness.  For me.  I do the mushroom coffee which has caffeine but not enough to trigger me.  I found out yesterday I’m facing a whole new set of health challenges.  I’ll know more after several intrusive tests coming up this week.  I hope to continue on my keto regimen.  Wishing every person here success and good health.,1723323453,54,keto
Complete-Library9260,"I do enjoy it. I do keto to manage joint and muscle pain. Let me tell ya, nothing tastes as good as being pain free feels.

Edit: I haven’t been on it for years, but I can’t see myself ever going back to carbs due to the benefits I receive from keto.",1723324579,18,keto
BotansCaretaker,"The carb cravings go away, and there are plenty of ways to indulge while on this diet. Have some juicy steaks. Add a big glob of butter to your meals (buy some good grass fed butter). Have some chunks of brie or whatever cheese you like as a snack. Make some alfredo sauce to go with your meals. Etc. 

I personally love eating this way, partly because I don't have to worry about bad reactions to my foods, and partly because I love meat, cheese, and butter.",1723323597,17,keto
louderharderfaster,"I am heading into year 8. 

If you had told me that I would not even see ALL my old favorites as *food* let alone that I would not crave them or that if I did have a craving it could be fixed with bacon or a yummy sugar free dessert (that I can bake, whip up myself) or that I would have a life this good, stable and fit at 55 - I would said ""you are lying; trying to trick me into being healthier"". 

I've never loved food this much or thought about it less.",1723331706,15,keto
HumorEfficient2842,"Worth it, trust me.. now I can play video game without anxiety and no more migraine",1723322996,13,keto
lovelife905,"Then don’t do it, I find keto works well if you generally like and enjoy eating meats, cheeses and low carb. See if there is an eating style that keeps you at a deficit that is more natural to you and makes you feel good. 

While I won’t say I don’t miss pasta or rice from time to time, I love the way my body feels when I eat basically just protein and vegetables. You have to change your mindset and think of food as fuel 80% of the time, find things that fit your macros and taste good enough. Eat to enjoy on special occasions, vacations etc.",1723323258,22,keto
AmNotLost,"Keto is enjoyable to me.

To me, the best part about potatoes isn't the potato. It's the oil, butter, cheese, cream, salt, etc. that we put on it. Potato, pasta, tortillas, etc. are just a carb vessel to get the good stuff to my mouth. I cut out the middle man and just eat the good stuff.

For me, the exception is REALLY good bread. I will eat a good slice of bread with nothing on it. If I'm somewhere with good bread, and I mean bread that's worth it, I can have a slice and make it fit in my day and stay keto.",1723324745,20,keto
shiplesp,"Yes.  But I've been doing it so long that there are very few high carb food that I miss any more.  And even if I do, it is fleeting.  Maybe I would like to eat more fruit than I currently can.  But that's about it.

Edit: You do know that when you start eating them again in September,  the weight will start to come back, right?",1723323218,17,keto
rachman77,"Yes. If I didn't enjoy it I wouldn't do it. There is no way I'd be able to sustain a diet I didn't enjoy.

Fatty cuts of meat, butter, cheese, and vegetables, what's not to like!

Tbh of you don't think keto or even low carb is sustainable for you then you should find something that is and stick to that instead. Hopping off keto (or any diet) after achieving results to go back to what didn't work in the first place is a recipe for yoyo dieting.",1723325898,8,keto
dank_memestorm,"I miss French fries, refried beans, tortillas the most. Or a sugary frappe coffee drink now and then. But I know they will only lead to the phenomenon of craving more carbs and being overweight is the consequence. As an alcoholic in recovery I also miss the ease and comfort feeling I get from alcohol but I know I am powerless to control my drinking and I treat carbs the same way now",1723327353,8,keto
Any-Stuff-1238,"Go to a nice steakhouse and get an amazing ribeye, then go home and eat a plate of bacon and realise that no lol oatmeal isn’t your favourite food.",1723325959,15,keto
chitchattingcheetah,"Ketosis is something that you can remain in for very long periods but you can also fall in and out by keeping your carbs under control. I think a lot of people use this diet as a learning tool to know more about their own metabolism, their carb sensitivities. How being not in a state of inflammation feels like. Then a lot of people move onto more of a low carb lifestyle, or keto Ith cheat meals. But to achieve this peacefully within yourself. You have to find triggers to remind you not to fall back to where you were, not make the cheat meal a reason to make it into a cheat day then cheat week but come back to some saner feeding habits. Whenever the craving has subsided.

I stay in it and I sometimes have a carbfull meal my bowels quickly remind me of why feast food should remain feast food and not everyday food.",1723329001,8,keto
sooohappy500,"I read somewhere that it's not so much that we eat what we like but more that we like what we eat.  I found this to be so true...now in my fourth year of keto. I used to love bread, pasta, rice but realize now how much they are mainly a vehicle for other flavors. I am still amazed at how much flavor I find now is plain celery, mushroom, romaine.",1723335348,5,keto
stevembk,I enjoy it. I like eating meat and fats and veggies. I dont care about bread and rice and pasta. Those things are plain and take the taste of the fats/sauces that are added to them.,1723324410,5,keto
frenix5,"A cyclical keto diet and you can have those foods (sparingly) with a little bit of planning. 

Pizza is my kryptonite and when on keto, I enjoy it about every 3-4 weeks and then work on getting back into keto the next morning.",1723325313,4,keto
GizmoCaCa-78,"The experiment is over for me.  I prefer keto as primary eating pattern with the occasional carb meal as a treat.  Im done with the bloated, full feeling cuz I tend to overeat carbs.  I like that keto basically eliminated all the junk food",1723332023,5,keto
Hellosunshine83,"How long have you been on it? The first 3 months felt like torture, but after doing it a lot I started liking it and liking the foods. It takes getting used to which i would say is prob 6-9 months.",1723325228,4,keto
alexmirepoix,"I feel your pain. My husband is Italian. Pasta and bread are life! Potatoes are my kryptonite. 
I haven't been Keto during the massive tornados that ripped through my city. I've been eating off plan. I CAN tell the difference.  I feel better on Keto, but I have a little something off once in a while. Makes it easier to live with.",1723327395,5,keto
Competitive-Night-95,"1. Learn to cook healthy keto (meats/proteins, keto veggies, fresh herbs). 2. If you start zero carb (carnivore), when you re-introduce cauliflower or celery after a couple of weeks it will taste like heaven. 3. Bonus: to avoid months of wasted time, do NOT follow any US keto influencers who want you to make American junk/dessert food from almond flour and fake sugar; tune that shit out, do not try to recreate desserts, do not do “fat bombs”. Just eat meat and non-starchy veggies but learn to cook with seasonings and herbs and you will blow your mind with both flavours and results.",1723327205,7,keto
Jon_J_,"Keto I always view as more a tool will low carb is more a lifestyle. I set goals with keto and when I reach convert to low carb.

Food of all types is meant to also be enjoyable",1723327503,7,keto
food4kids,You’ll get over it ,1723322832,8,keto
Puzzled_Draw4820,"Absolutely! I love the food and I love the way I feel. If I eat grains now all my old health conditions return, my energy stops and I get brain fog. No thanks.",1723325832,3,keto
jwbjerk,"No food tastes as delicious as feeling healthy and energetic feels good.  And you only enjoy food a few hours a day, while better health pays off all day long.

I feel like I’ve discovered a cheat code to life.  

Yes, I used to enjoy a lot of the things that are now off my menu.  One adapts.  Tastes can change.

I’m doing a carnivore form of keto, so my menu is even more limited and I love it and everything I eat.  So what that I would also like the taste of some other things I’m not eating?",1723326166,3,keto
Unicorns240,"Well, it helps control. My impulsive carb binging. And being in calorie deficit has been very much easier on keto than any other kind of diet.",1723327843,3,keto
theXwinterXstorm,Yes because the difference in how I feel vastly outweighs how shitty I feel when I eat bread/rice/pasta/potatoes. Do I miss some of those items? Yeah from time to time whenever I'm near carby food that smells really good. I prefer to feel better than feel like garbage.,1723328938,3,keto
gadzookery12,"For me, once I starting associating those foods with inflammation and feeling sluggish it was easy to mentally block myself out of wanting them any longer.",1723329274,3,keto
Pius_Thicknesse,"For me Keto was not fun whilst I was continually stressing and trying to find carb alternatives. Keto pizza, keto pasta, keto bread. Nothing taste as good as the original and it's depressing, and the keto alts usually have some lab shit in them.

I shed that mentality and just keep my keto super simple and clean. Meat (steaks, pork belly, lamb, chicken thighs) and low carb vegetables and lots of olive oil. Now I love it and feel amazing.",1723332477,3,keto
Syssyphussy,"I love the clarity of mind 

I love that I can go out for an afternoon or a whole day & don’t need to worry about finding anything to eat every couple of hours 

I love not experiencing hanger

I love focusing on real food",1723338288,3,keto
AYBABTU_Again,God yes! Salt and fat = flavor,1723338821,3,keto
jb4realz,"I've enjoyed it. I don't see a situation where I go back to being ""full carb.""",1723351041,3,keto
lAmKarma2022,I’m addicted to cauliflower rice! I buy plain and season with spices to match the meal. I give it to the kid with no complaints!,1723354231,3,keto
Sufficient_Window599,"5 years on keto. I do enjoy it. Sometimes it does suck when you are on travel and have limited options or craving something sweet. 

But I also remember exactly how hooked on sugar I was. 

My big realization as to it being a real problem was around day 7 or 8 of no carbs. I was desperately craving carbs. I found that if I walked through kitchen and carb-y snacks or food were out that my hands would kind of independently pick stuff up without me thinking. But the biggest eye opener was the floor pizza. 

One of my kids had left a half eaten piece of pizza on the ground on way to empty trash (taking pizza box to trash can outside). This slice had fallen out of box and had ants on it. I see this and my first thought, no joke, was - ""I could eat that"".

This was my big awakening that the sugar need kind of hijacked my brain. Anything that would make me crave ant-covered half eaten garbage pizza had to be bad for me. So I doubled down and eventually the cravings went away. Blood work (cholesterol, blood sugar, a1c, triglycerides) is great. 

I strongly recommend emergency bacon. No joke.",1723356537,3,keto
FitStorm7699,"I absolutely love it. Very occasionally I may have a beer, very occasionally I may have a bar of chocolate but I never feel like I’m missing out. The pros of Keto far outweigh the daily Westernised carb laden shi77y diet.",1723395598,3,keto
idontwannabeherebish,"Doesn’t bother me.  I feel fuller easier, quicker, and stay full feeling longer when I don’t do a bunch of carbs.  I’ll try carbs again and then feel like shit. I am insulin resistant so it affects a lot for me.  Luckily, I like the protein and fats more",1723396804,3,keto
CornerStreet2385,"There are oatmeal alternatives if you get creative and learn to enjoy different takes/interpretations on carby traditional foods  like chia and basil seed puddings, oatmeal type dishes made with coconut flour etc",1723324569,2,keto
Fun-Insurance-3584,"For me it took 3 days to get rid of craving carbs and sugar and I would breakdown and have a teaspoon of chunky peanut butter. It took two weeks to completely get rid of any cravings for carbs. I do enjoy it keto.  I pay so much more attention to what I put in my body and feel great with cutting out most sugar.  I do struggle with eating too much processed meat because it’s so easy to grab as a snack, but the possible negative effects are dwarfed by my weight loss.",1723324662,2,keto
VikingMonkey123,I had a carb heavy meal last night on a cheat day and holy moly did not like how I felt. You could try kohlrabi as a potato substitute.,1723324999,2,keto
Stock_Relation7775,"I'd pick a big juicy steak over potatoes or rice anyday! I love it, I feel amazing and energized. There are definitely lots of treats you can indulge in and foods that mimic the food you miss. Your cravings will disappear and your life won't be ruled by being hungry all the time.",1723325154,2,keto
Arntor1184,"Been keto for 9 months now and at first it was really hard to give up rice and potatoes since they are my favorites but it gets easier over time. I still crave rice bad sometimes, it is legitimately one of my favorite foods but it's worth it in the end. I just set my mind to it and decided I'd rather go without rice if it meant a healthier better looking physique.",1723326613,2,keto
lililav,"I've never really liked carbs, but loooove meat, fats, and dairy, so Keto comes quite naturally to me. Sometimes I want to have something special and indulge, but it's pretty rare. I had my first fine dining experience today and it was magnificent and super worth it, but I'm very happy to get back to Keto tomorrow, as my usual way of eating.",1723327323,2,keto
RetnikLevaw,"I find it way easier to avoid carbs when I'm in ketosis. The cravings go away. The only thing I find miserable is my wife and I like to go out to eat a lot, and it's extremely difficult finding keto friendly options. We end up going to the same handful of places that either have reasonable options, or will at least allow you to modify dishes to suit your diet. 

The number of places that will let you swap the potatoes and toast for an extra egg or something are few and far between.",1723328529,2,keto
NotHowAnyofThatWorks,"I just hit a cheat meal once a week and then fast after. Pasta, rice, potatoes, fries… and then I skip breakfast the next morning and back to keto by lunch. It’s my compromise. Also, on vacation or holidays I don’t torture myself by trying to do keto…I just enjoy and return after. Means I’m doing Keto like 300 days a year and still not losing out. Hasn’t caused me to retrograde or anything.",1723329048,2,keto
MajorSabby,"I enjoy not having diabetes or heart issues (which are considered ""genetic"" in my family) or any other medical issue related to eating excessive carbs/sugar. I do occasionally miss pasta or hoagies or, yes, potatoes are a big one, but at some point I honestly don't think about it as much anymore.

I love eating my steak and vegetables though! I have stopped keto before, and I had gone back to eating, potatoes, pasta, desserts, etc, but it turned out to be the biggest mistake. I would strongly recommend NOT doing that cuz the lbs came back with a vengeance.

Try zucchini fries, or making cauliflower mash... It might help with cravings! You got this!! 💪🏼",1723331005,2,keto
kllrbnny42,"I have loved it so far but it can be a challenge in the long term. I tried varying days of high carb but it ended up turning into days and weeks binging so I stopped. I am now doing a once a month high carb dinner/desert and that has been working well for me, I look forward to it every month and still maintain ketosis pretty well during the rest of the month.",1723334463,2,keto
Blaznkc,1. Word - Jalapeño Poppers make it worth it!!!!,1723334956,2,keto
itsafuseshot,"If keto is hell for you, and you don’t need to do it for a particular health issue, then don’t do keto. You can lose weight just as easily on a standard cico diet and have plenty of room for rice and potatoes and oatmeal",1723336151,2,keto
whatsinyourcheeks,"I've only been doing it for 6 months but I will never go back. I love what I eat, I feel better than I have in years, and I don't see any reason to return to my previous WOE",1723337801,2,keto
Threeboys0810,"I have found that I don’t crave things like rice and potatoes that much.  Most of the time when I cook for my family, I wonder if I should have a little morsel just to taste it again, and half the time I don’t try it and the other half of the time maybe a tsp of rice and I then realize that I am not really missing anything.",1723341085,2,keto
Fognox,"Yeah, 8.5 years on it here and if I wasn't here for the physical/mental health benefits I'd pick it just for how much better the food tastes. Granted, I've always had a preference for fattier foods and green or flavorful vegetables. As a kid, I haaaated the days where I'd have to eat oatmeal or beans/rice or whatever.",1723343968,2,keto
shojokat,I definitely do once I'm adapted. Carbs start tasting like filler at that point.,1723344448,2,keto
SamiHami24,"I've completely lost my taste for those foods... and my hubby used to joke that my favorite meal would be potatoes, rice, pasta, and bread. Keto has changed the way I eat, and I do enjoy it. It didn't happen overnight, but at some point, I just stopped thinking about those carby favorites and never crave them anymore.",1723353737,2,keto
Tough-Horror-2827,"Honestly, if I have a carbnite, I realize that I don’t love those things as much as I think I do. Not only are they just not that good, but they also make me feel like crap when I eat them after not eating them for so long. I love keto because eating this way actually makes me feel good",1723354818,2,keto
Global_Development_9,"I have zero cravings for carbs, so yeah, I enjoy keto a lot. Cravings for chicken thighs are high, though 😅",1723357597,2,keto
GiGiEats,I’ve been living a ketovore life since I was 14 years old! I friggin LOVE IT.,1723365134,2,keto
Shot-Unit9030,"I look at it this way. Vegans done eat meat, people allergic to nuts don’t eat nuts, gluten intolerant people don’t eat bread. I don’t eat carbs. Really simple",1723366806,2,keto
DrewBrewButler,I enjoy the keto diet (choices) BUT man do i miss those carbs (im addicted to). Beer n Bread mostly,1723384514,2,keto
nesede,"No, it's fucking awful. The lack of textural variety is just a nightmare.",1723392064,2,keto
bofre82,"Honestly, keto itself is hard because it’s easy to justify mock foods labeled as keto and it keeps you desiring those foods.  Try for a keto like you would have done 50 years ago when it’s just very low carbohydrate and not trying to make a substitute cheesecake.",1723395629,2,keto
CeramicDuckhylights,It’s fine it becomes effortless after awhile. Nothing about it is HELL. I do it in hopes of it treating my anhedonia issues and so far it by itself doesn’t do a thing towards that regard but I still do it and it’s easy,1723397985,2,keto
brnnbdy,"Yes. I love it.  I love meat and fats and for it not to be evil anymore was such a blessing.  Even as a kid I was always the one wanting steak.  Everybody handed me their fat trimmings and I gobbled them all up.  Then I got fat in my late teens early twenties and thought I had to drop the meat and fats.  That was hell for me.  Now I have to stop all the other junk and eat what I love to be healthy.  What a joy! 

I gotta say I love rice and pasta and bread too, but as long as I get my meats I can handle dropping those.",1723402676,2,keto
InterimFocus24,"And I can’t ever imagine going back to rice, oatmeal, pasta, sugar, or foods that convert to sugar. There is not one valuable thing about them. They make you feel like shit, and they can cause diabetes.",1723403018,2,keto
Lodahnia,"Yes I enjoy it, and why wouldn’t I? I have pizza, flaxseed “oatmeal”, bread, cakes, chocolate and buttery food in my rotation and still keep my carbs around 30. It’s amazing what you can craft when you have to be creative!",1723404397,2,keto
Jay-jay1,"I've tried rice, potatoes, and oatmeal cooked, but no salt, sugar, spice or oils added. They are completely bland and unappetizing. That's sort of my litmus test of whether I truly like a food. In a way, french fries were just a delivery vehicle for salt and ketchup. 

Conversely I've camped and forgotten salt, and still enjoyed pork chops, or beef strips.",1723404657,2,keto
louderharderfaster,"I was once a keto basher. ""How could eating that much fat be healhy?!!""

But then I ran into someone at my gym who VERY reluctantly told me the secret to his amazing results inside 6 months. It only took me a few weeks of keto to understand why he was so hesitant to talk about it. 

I am heading into year 8. Keto changed everything for the better - I am 55 and outperform people half my age in activities and work. My friends have witnessed me go from a depressed, fat and anxious 47 year old to a stable, fit woman *in menopause* and they still won't try keto. They have no idea you stop missing the very foods they believe they can't go without.",1722362868,90,keto
AdMental1387,"I have a hunch that people hear the word “keto” and think “eating fat and drinking coffee with butter in it” which isn’t the case. Add on lifelong conditioning by the FDA that fat=bad and mix in jealousy and resentment and it’s the perfect storm for people to go all in bashing you and the “diet”. 

I’m the same way. Maybe other diets work better for other people but for me personally, this feels like the way I should be eating. I’m down almost 50lbs since February. I’m under 200lbs for the first time in my adult life. I feel better. I sleep better. I dont have insane hunger. I don’t crave sugar. I have much better self control. It’s all a win for me. I just never use the word “keto” around people.",1722359368,117,keto
mstr_of_domain,"It goes against everything we were taught. And, like many things, there are extremes and those are the ones that get the most attn. There's prob a bit in there about social conformity, too. I feel better about my problems if you have the same problems  - so, screw it, let's eat cake. It's also big bucks if we're all on meds permanently.",1722359344,141,keto
Repemptionhappens,"Consider the source. Can’t tell you how many doctors will rag on keto then go off about their IBS or other chronic conditions they suffer from as they waddle around looking a decade older than they are drinking some liquid diabetes concoction. Doctors are just people and they’re people who did not learn about nutrition or holistic health.  Medical professionals (me included) were  taught that everything is genetics and to push meds and/or surgery.  Not coincidentally, the two most expensive treatments, that more often than not, will make you a life long patient.",1722360127,25,keto
