Author,Text,Date,Score,Keyword
kharvel0,"I only mock plant-based dieting speciesists and animal-ag shills who masquerade as ""vegans"" and try to dilute the meaning of veganism to the point where it becomes meaningless and anyone can declare themselves to be “vegan” whilst contributing to or participating in the deliberate and intentional exploitation, abuse, and/or killing of innocent animals. I’ve taken the liberty of classifying them by categories as follows:

**Class 1: Non-Sentientists**

Oyster boys - people who claim that bivalves are not sentient and eating them is “vegan”.

Pescatarians - people who claim that fish are not sentient and eating them is “vegan”.

Entomophagists - people who claim that insects are not sentient and eating them is “vegan”.

**Class 2: Plant-based Dieting Speciesists**

This class is pernicious to the vegan movement as they are plant-based dieters who masquerade as “vegans” while at the same time happily fund the violent killing of innocent animals to feed certain animals that they keep in captivity on basis of species. These people make comments like the ones paraphrased below that just highlights their speciesism and their non-veganism:

*Innocent animals would have been abused/killed by someone else anyway to feed my pet python so I might as capture live rats myself and feed them to the python and still call myself vegan!*

*I happily purchase animal products from slaughterhouses to feed my pet animal but I am still vegan because I don’t consume the animal products!*

*My cat is a carnivore and I love my cat. I will gladly kill innocent lambs and piglets every year to feed my cat and keep her happy. I’m still vegan!!*

*My dog is so friendly and loves me so much. But she hates the plant-based foods. So it pains me to purchase animal products from slaughterhouses that violently kill innocent animals. But I consider myself to be a vegan!!*

*My senior dog requires a medical prescription of 100 bloody goat carcasses every year to survive. I am okay with beheading 100 goats every year to keep my dog alive and I’m still think I’m vegan!*

*I never allow any animal products to be brought into my house by anyone because my house is a vegan house. I make an exception for myself when I purchase animal products and bring it into my house to feed my cat.*

**Class 3: WhatAboutIsts**

This class comprises of apologist vegans who use classic carnist whataboutisms and talking points to defend non-vegans, omnis, plant-based dieting speciesists, animal-ag shills even if they themselves do not believe these people are vegan.

**Class 4: Animal-Ag Shills**

Carnists, omnis, and plant-based quislings working for the animal agriculture lobby who masquerade as “vegans” using “x years vegan” flairs/tags and engage in spreading fear, confusion, and doubt throughout the vegan community in order to dilute the meaning of veganism and push the odious notion that purchasing animal products is “vegan”.",1731470295,-2,vegan
OneMonk,Any movement can have extremists than end up harming their own self interest and their mission’s by not being more tolerant. Veganism is especially guilty of this.,1731523783,0,vegan
Droog_666,"I wish more people had OP’s attitude. I went vegan 5 weeks ago and went to this sub for information. I found it very unwelcoming and borderline toxic. I’m not ignorant so I understand not to lump every vegan as being that way. I hate stereotypes but there are way too many people in this sub who fit that preachy, close minded elitism that turns people off from vegans and veganism. I also understand that can be a defense mechanism from being continuously mocked from omnivores. But to me it’s a big turn off and reacting to dickheads by being a dickhead is just shabby",1731524029,0,vegan
petreauxzzx,I got downvoted for dare saying I’m a vegetarian…sheesh,1731478825,-2,vegan
rfmax069,"Yea ppl
On this sub are what we all know from
The media to be angry Karen vegans. Even if you are vegan, they’ll still come for you with their entitlement.",1731477943,-2,vegan
Curious_Ad_3280,Geez relax and step into a slim jim.,1731450312,-30,vegan
redrumyddad,Mock all vegans equally. Noted.,1731455771,-18,vegan
ILuvYou_YouAreSoGood,New vegans need to know what they are getting into.,1731448502,-43,vegan
Sagaincolours,"I have been paleo since 2008 when all there was, was Dr. Cordain's original website. 

My body works best with eating like this. If I don't, I get a lot of health issues. 

I don't participate much online about it because it is just my regular way of eating by now.

I am less strict now, though. Mostly about eating more sugar than recommended. And I eat rice.",1718863664,42,paleo
bananachomper,"Paleo flexible for sure. I wish I was more strict, but times are harder so organic white rice for sure with some organic masa harina blue corn flour for tortillas etc. I still focus on fat heavy but have included more carbs unfortunately. When I have a big greenhouse going I hope to be more strict but frankly I enjoy corn and rice now, it’s nice in a harsh world. Oh and I do have food allergies so yeah.",1718856866,11,paleo
wholemadefam,"I’m paleo flexible for sure. I think often of going back to a more strict approach but it’s hard to get back in the swing and stick with it. Like you, at home I still mostly use a paleo template for our meals but when we go out I’m not strict at all. I am celiac so I never have gluten and generally keep grains to a minimum, but besides that I’ve reintroduced most everything in small doses. Lately I’ve felt less than amazing, so maybe this will be the push I need to focus more on my diet.",1718859653,12,paleo
AcheeCat,"I had kids and paleo didn’t work well when I was pregnant and I don’t have the energy to cook myself a separate meal.  Maybe in a few years when kiddos are older and we are in a better space I will go back, but I don’t know yet",1718862223,11,paleo
rocknrollwitch,"Going Paleo in 2012 helped me understand a lot of my food sensitivities and reactions, many of which were behind my constant GI woes and near-constant fatigue. Seeing the changes that occurred not only physically but psychologically through dietary changes also helped spark an ongoing passion in nutrition and biochemistry for me. I even changed my major in college to reflect this newfound interest (didn't finish tho, teehee)

I left the Paleo community in general when political views started to become conflated with dietary changes and exercise preferences.

That said, I've really only kept up with the dietary and lifestyle changes that have made the most difference for me. Gluten remains an absolute no. I eat few fruits and some veggies. I can tolerate some dairy (mostly cheeses). I keep seed oils to a minimum but I'm not afraid of some French fries. I almost never drink sugar but I'll have a diet coke as a treat every now and then. And I'll definitely indulge in the oft-demonized ""gluten-free/Paleo junk food"" a few times a week (those Lesser Evil Paleo Puffs RULE omg). And I'm Mexican, so corn tortillas are NEVER leaving my diet. I also walk at least 10-15k steps a day because I have an active job and I try to lift heavy stuff 3 times a week.

I think I'll probably be following this framework or something similar as long as it works for me. I'm mainly glad to not have severe stomach pain and bloating every single day like I did for my entire life before Paleo.",1718873619,8,paleo
churroz85,"I just got back to full Paleo a couple weeks ago. Been rehearsing a comeback for some time now, but never could catch up. I've been strict Paleo from 2014 to around 2017, when things got complicated and I couldn't keep my head on many things.",1718873475,9,paleo
WendyPortledge,"I’ve always called it “personal paleo” for me as I consider my diet to be paleo-ish, with modifications that suit my own body. I don’t eat eggs but I do eat potatoes and some grains, that sort of thing. I’ve been eating this way for about 8 years since starting with AIP.",1718881440,6,paleo
foslforever,"I did paleo for 6 years, did keto another 8 years; and now do an ultra low carb Mediterranean diet",1718869029,5,paleo
gmorkenstein,Been on and off the diet for about 15 years now. It’s my baseline for sure. I’ll do slightly modified Whole30s now and again to reset.,1718893606,5,paleo
37thAndOStreet,"Very cool discussion, OP! It's 8 years almost to the day since I started Paleo. I wanted to get a six pack and Google led me to some Paleo blogs. I started paleo and CrossFit around the same time, right before my 25th birthday.

I remember throwing out the sugary and non Paleo stuff in my cupboard, like Aunt Jemima syrup (to replace it with organic maple syrup). My CrossFit coach said that almost no one in our particular box was really Paleo, although he explained more about Paleo to me when I asked, and I remember one member mentioning Whole 30 at one point.

I was pretty religiously Paleo for about 2 years. Didn't have a vanilla milkshake with sprinkles mixed in (possibly my fav food) for two full years. I did get down to a six pack that I was proud enough about to look for any excuse to take my shirt off lol. 

A major life crisis happened that dislodged the rhythm I had. It took about a year for the six pack to become completely non-visible although the work outs in CrossFit were so strong that I can still feel the six pack muscles, the biceps and a little bit of the pecs to this day. I tried and failed to reboot both Paleo and CrossFit a lot during the pandemic, although I was overall too depressed from a continuous stream of crises.

The most successful weight loss methods for me have been calories in calories out methods that do let you have some non paleo treats -- as well as, unfortunately, involuntary methods of weight loss, like extreme poverty, at times, or situations where I was being malnourished while in the care of others.

I still kind of am Paleo in some of my beliefs about food, some of the ways I navigate the supermarket, the way I'm seen among my friends as the one who used to be passionate about Paleo and CrossFit, and whatever else I can hold onto from those two years, which were some of my fav years of life. 

I drink red wine as my favorite alcohol where possible. I don't touch beer, although I do drink White Claws now, and I allow a fruit juice (oh no) when I make whiskey lemonade. The recipes I use to make margaritas and mojitos are actually both Paleo versions. Amidst it all, it was actually only literally within the past week that I started drinking apple juice recreationally again, and every so often there will be experiences like that where I re-engage with a food I haven't touched in several years. I drink almond milk and that's a hard preference. I am extremely unlikely to return to regular milk anytime soon.

I feel like a lot of my willingness to do Paleo was because I only knew about a relatively small number of foods and had been eating like a college student. It's harder to do now that I know what a broad array of foods there is out there. 

I've ballooned up and down 70 pounds multiple times throughout the pandemic and ensuing years. I'm relatively near my peak of CrossFit level of skinny right now -- unfortunately due to one of those periods of malnourishment. Pizza is the thing that really makes me gain weight, so even when I'm eating Doordash a lot, I look good. And who knows what the future holds, as far as returning to either Paleo or CrossFit, or both. 

Some of the fundamental problems that have terrorized my life for the past 6 years have been solved. So I'm excited to look and see what's next. I have different ideals of body image right now than I did when I started Paleo. I'm kind of intrigued by the dad bod transformations that happen in men's 30s and 40s, so when I sit down to plan my next big fashion push, I might want to find a hybrid between being thick and meaty while also being trim. I like the way Nick Carter and Justin Timberlake look right now, for example. I wonder if society has changed over these few years and dad bod is just considered hot now in a way that it wasn't back then. 

I remember specifically referencing Zac Efron as well as a social media account called The Warwick Rowers as my ideals back then. If I had to fit one fitness role model right now, well, idk. Pietro Boselli is pretty nice, and a lot of TikTok and OF influencers have influence on me. I have trouble seeing myself ever divesting from wanting a six pack. 

The vitamins and blood sugar level aspects of why Paleo are important as I get into middle age.",1718926638,5,paleo
djfaulkner22,"My sense is that paleo is a ‘gateway drug’ to stricter diets. I know it has been for me. I’d be sooooo happy if regular paleo still worked for me, but unfortunately have had to restrict more and more over time. I think this is a common experience",1718861579,4,paleo
Interesting_Wolf_668,"As the term developed I realized it wasn’t necessary (or beneficial) to follow Paleo as I did in the begining. Eating Whole Foods, or ‘close to the ground’ serves me just fine now days. But I’ve also learnt a bit of flexibility with the diet is a good thing, too. Balance, as always, is key.",1718889415,4,paleo
stonecats,"no, i faced the fact that i missed certain carbs too much.    
r/intermittentfasting this lifestyle change worked better as i   
could go back to enjoying healthy carbs a few hours each day.",1718891860,4,paleo
TruePrimal,"The hype probably has shifted slightly to words like ""unprocessed"" and ""natural"" but the idea is about the same ""just eat real food.""",1718892600,4,paleo
reddstudent,"I’ve moved on to /r/animalbased, which I consider to be Paleo 2.0

Paleo asked the right questions but locked in the wrong formula for how our ancestors actually ate.

The Hadza, and Paleo 2.0, is: Nose to Tail animals (organs are key), Fruit, Raw Honey and Tubers. 

Pretty much the Autoimmune Diet, but more paleo, lol..",1718905199,4,paleo
DisastrousSet11,"I still loosely follow Paleo, although probably only 75% of the time as I do include dairy in my diet and sometimes rice, potatoes, and very occasionally beans. I also won't say no to having pizza and a beer out with friends from time to time. I did see not too long ago that the Paleo diet was rated as the most effective diet for reducing inflammation, even better than the Mediterranean diet, which was surprising because I hadn't seen any reference to Paleo in a few years at that point.",1718891643,3,paleo
Tarlus,"For the most part, yes.  We stray but always feel better when we use it as our baseline.",1718882598,2,paleo
Madden63,"Paleo has been my standard way of eating for years, not super strict but close enough for me to see and feel the benefits. Some things I won’t sway on like cream in my morning coffee, or regular Mayo and green beans. Where I get tripped up is if I cheat too many days in a row or close together, like vacation or summertime cookouts etc. If I eat carbs or sugar I turn into a ravenous beast and it’s super hard to get back on track. It’s literally like a detox, but eventually I do it, go through the first week feeling like hell, then I’m back on paleo and screaming from the mountaintops how good I feel. Currently in that stage right now. Aside from the hype and trends I got so into paleo all those years ago because how well my body and mind responds to it, for that reason it will always be my default way of eating.",1718885662,2,paleo
havidelsol,I went through some bad times along with moving state around 5 years ago and couldn't keep my cooking discipline up. I still think paleo first when shopping or eating out but haven't been strict since then.,1718856161,4,paleo
Therusticate,"I’m more focused on AIP currently, which I consider a more strict Paleo anyway. When I’m done with AIP I want to stick with paleo again and bring back some of my fave foods that I can’t have right now 🥲",1718873376,1,paleo
Spiritofpoetry55,"Yes, a modified form of it that's more between AIP and Paleo.  Definitely following Dr Price's approach to Wholefoods.",1718894259,1,paleo
Cocoricou,"I'm less strict. I eat white rice, peanut butter and some refined sugar but I still can't eat butter.",1718894464,1,paleo
Mysteez,i wish but no willpower,1718899700,1,paleo
jgainit,Potatoes count for paleo right? And paleo is kind of like keto except for a few things that might have some carbs?,1718914557,1,paleo
jnbeitler,I was paleo years ago and since have stopped. I want to go back but allow legumes. I need the fiber from them.,1718920494,1,paleo
Optimal-Meeting-7288,"I just recently started paleo, but it has been amazing! I am like you and eat paleo at home, but don’t sweat it if I have to eat away from the house. I feel like not being so strict when out of the house will make it more maintainable. Sorry, I know I wasn’t your target for this question, but just my thoughts 😃",1718921886,1,paleo
TheMarshmallowFairy,"I haven’t intentionally eaten paleo in 10 years; I joined this subreddit long after stopping. I like following a variety of food, nutrition, and health pages/groups on social media for information, updates, and recipes.",1718946638,1,paleo
StaySpecial4010,"I am on and off Paleo. I use it also sort of as a ""baseline"". Partly depends what's going on in life but when I pick what meals I cook or desserts I bake, I tend to pick Paleo recipes. When I'm eating out, I don't worry about it.",1719951655,1,paleo
c0mp0stable,"Kinda depends what you mean. I don't think The Paleo Diet(TM) really represents what most paleolithic people ate. From research I've seen, fatty meat was much more of a staple than lean mean. And things like seeds and leaves were most like fall-back foods, not regular parts of most groups' diets. So I've adjusted accordingly. My goal isn't necessarily to replicate any paleolithic dietary pattern, necessarily, so I tend to combine trends I've seen in my own research with more modern foods like raw dairy that have obvious benefits.",1718878412,1,paleo
lowfour,"Paleo is a great set of guidelines to eat healthy. I try to follow it as much as I can, and in fact it is easy because as Spaniard I have always eaten Mediterranean food that is quite paleo itself. I don’t obsess with being super strict but if I need to chose between meat with pasta or meat with salad I always take the later. I mean eat whatever makes you feel good, not whatever is fashionable.",1686892448,33,paleo
Blarglephish,"I really like Michelle Tam’s (‘Nom Nom Paleo’) take on the paleo diet (paraphrasing): it’s not about historical re-enactment, nor is it about some trendy new dieting fad. Paleo is a lifestyle that posits that we are healthier eating more whole, unprocessed foods that are helpful to our bodies; and less of the things that are harmful to our bodies.

I agree with that take, and that advice doesn’t go out of style.",1686925128,26,paleo
B1ustopher,"I’m still mostly paleo because I have to be- I have celiac, plus sensitivities to dairy, tomatoes, lots of flours, thickeners, additives, colorings, etc. There are very few processed foods that I can eat, and the ones that I can safely eat tend to be super clean ingredients or clearly paleo. I lean towards autoimmune paleo generally.",1686891524,22,paleo
professorchaosishere,Second month of paleo. Always come back to it when I go off track a bit. Helps my fitness and general health.,1686895004,17,paleo
dhdewing00001,"I never really moved on from paleo, I just got lazy. I really think it’s the best framework for eating. Even when I fell off the wagon, as it was, I recommended and extolled it’s virtues to others. 

When I discovered paleo, and how awesome I felt , I was hardcore (like most people, I’m sure), but the. I started slipping backwards slowly (meeting my wife and her family, who are hardcore standard American dieters didn’t help), and I found myself to the point where I was just eating gluten free. But I recommitted myself about a month or so ago (tired of feeling bloated and like crap all the time) and I’m remembering how much I loved it. 

I’m not 100% paleo but I think I keep a good balance. I don’t like sweet potatoes so I eat white ones (and I think it’s total BS to suggest white potatoes are not paleo); I have a glass of wine with dinner, and homemade airpopped popcorn once every week or two. And when we go out to eat, I keep it as paleo as possible/reasonable, but I don’t stress like I used to. If a food makes me feel bad, I don’t eat it. If it doesn’t make me feel bad, and it’s not paleo, I consider it a treat and I try to limit it. I had gluten free cake on my birthday.  

So many of my family members have sensitivities to foods, and it blows my mind they’d rather just have stomach cramps and diarrhea every evening than just not eat dairy. But, I digress.",1686927404,15,paleo
ceemko,"For me personally, paleo was amazing to push a concept of healthy eating through putting it into some easy to understand framework. 

At the time when I was learning about paleo, keto sounded super unhealthy, because people were just posting images of dipping bacon into mayonaise. I think it naturally came to an intersection, where what I considered paleo back when I started, is now 'clean keto'. Everything that goes hand in hand with taking care of your health, ilke intermittent fasting, elimination diet, understanding of impact of sugar and gluten, and trying to limit artificial and overly processed food just makes sense once you start digging into it a bit more.

No matter how you label it, if you adjust it to your own body by doing some well informed modifications and verifications with how you react to the food you eat, you can't go wrong.

Where I was making bad dietary decisions with wrong information, I am able to make now well informed mistakes, and while I pretty much only lurk, paleo subreddit set me on this path (and I found out about paleo from some random loseit post).",1686902646,9,paleo
WendyPortledge,"I started with AIP about 7 years ago. I’m what I call “personalized paleo” now and have been for many years. I eat some grains and potatoes. For me, it’s just eating real food. I have autoimmune conditions they are triggered by foods and unnatural ingredients. I find Paleo is the easiest way to describe how I eat, however when I explained it to my doctor he wrote it down as Neolithic Diet, not Paleo. While that may be slightly more accurate due to allowing grains, very few are aware of the Neolithic diet. 

It looks like Keto pushed harder and made its way into mainstream marketing far beyond Paleo. Probably because they allow cheap alcohol sugars that big companies love. More products they can produce cheaply, slap the Keto word on, and make a profit, just like “plant-based”.",1686914065,7,paleo
justdan76,"Paleo originally was a lifestyle, with many components beyond diet, but the term became associated with a fad diet.  I’m not “strict,” whatever that would mean with something that’s supposed to be a set of healthy practices, but I definitely use the principles as much as I can.  Walk a lot, get fresh air and sun, limit screen time, have affection and physical contact with people in your life, socialize, pursue art music and skills that interest you, don’t eat processed junk (well…not often anyway).  

The fad diet part is probably mostly people who are looking to lose weight.",1686923219,8,paleo
PertinaciousFox,"I still agree in principle that a Paleo-ish diet is healthier. I give a bit more leeway with the starches and legumes, though. I follow more the principal of ""unprocessed, low sugar, and wheat-free."" I really like Denise Minger's book, Death by Food Pyramid, as she looks at the data around what diets have been proven most healthy and what they have in common. I don't actually follow my ideal diet, because it's too hard, but I strive to move in that direction insofar as I'm able. The one time I actually succeeded in having a mostly Paleo diet (2011) I was the healthiest I'd been. Healthy weight, better mental health, better digestive health, less pain, less acne and rosacea. One day I'd like to get back to that point, if possible.",1686898704,5,paleo
theraggedflaggon,"Hey I’m a PA not a doctor, but I really like paleo from a medical perspective and personally adhere to the core principles of the diet. 

Fuck fads. Paleo is an excellent diet in general for people trying to lose weight or manage chronic disease. I’ve personally recommended it to my diabetic patients or anyone struggling to navigate what is and isn’t healthy in the world of fad diets. It’s overwhelming for people who have lived most of their life consuming processed food and sugary beverages to know what they SHOULDN’T be eating. Rather, I like using paleo as a template for what they (we, all of us) SHOULD be consuming more of—veggies and lean meat. 

I will usually advise a combo of paleo with a Mediterranean diet for most of my middle age patients struggling with diabetes, cholesterol, no issues, etc.",1686949262,6,paleo
zizuu21,"Paleo tended to be ketogenic. I early on realised i need paleo+ , or perfect health diet. Basically addindlg starches in rice and potatoes and gluten free bread. I think paleo with few tweaks is basically best eay forward. 

Its crazy how long ago it all seems now",1686890309,10,paleo
StiffDiq,"People are doing keto again. Funny because a lot of paleo foods I buy are now plastering on their packaging that they are keto. I personally cycle my dieting from paleo to keto every 6 months to maintain a balance, but in this economy keto is more sustainable",1686899074,5,paleo
_CommanderKeen_,I'm at 19 years now I think.,1686922799,4,paleo
